name,seo_url,seo_title,short_description,description,parent_id,kind,status,featured
Solar Panels,solar-panels,Solar Panels | Compare Solar,High efficiency solar panels,Solar panels convert sunlight into electricity. Our selection includes monocrystalline and polycrystalline options for residential and commercial use.,,product,active,true
Inverters,inverters,Solar Inverters | Compare Solar,Convert DC to AC power,Inverters are essential components that convert the DC electricity generated by solar panels into AC electricity that can be used in your home.,,product,active,true
Batteries,batteries,Solar Batteries | Compare Solar,Energy storage solutions,Store excess solar energy for use when the sun isn't shining. Our battery options include lithium-ion and lead-acid technologies.,,product,active,false
Mounting Systems,mounting-systems,Solar Mounting Systems | Compare Solar,Secure installation hardware,Mounting systems securely attach solar panels to various roof types or ground installations.,,product,active,false
Solar Monitoring,solar-monitoring,Solar Monitoring Systems | Compare Solar,Track your system performance,Monitor the performance of your solar system in real-time with these advanced tracking solutions.,,product,active,true
Residential Solar,residential-solar,Residential Solar Solutions | Compare Solar,Complete home solar systems,Complete solar solutions designed specifically for residential properties.,,solution,active,true
Commercial Solar,commercial-solar,Commercial Solar Solutions | Compare Solar,Business energy solutions,Scalable solar solutions for businesses of all sizes to reduce operational costs.,,solution,active,true
Off-Grid Systems,off-grid-systems,Off-Grid Solar Systems | Compare Solar,Energy independence solutions,Complete systems for locations without access to the electrical grid.,,solution,active,false
Grid-Tied Systems,grid-tied-systems,Grid-Tied Solar Systems | Compare Solar,Connected solar solutions,Solar systems that connect to the utility grid for optimal efficiency and backup.,,solution,active,true